{
  "schemaVersion": "1.2",
  "toolkitVersion": "3.0.1",
  "runId": "88888888-8888-4888-8888-888888888888",
  "startedAtUtc": "2026-08-22T15:00:00.000Z",
  "finishedAtUtc": "2026-08-22T15:00:01.250Z",
  "durationMs": 1250,
  "actionId": "SystemInfo",
  "actionName": "OS Version and Uptime",
  "readOnly": true,
  "stateChanging": false,
  "preflight": false,
  "targetMode": "Remote",
  "transport": {
    "name": "WinRM",
    "authentication": "Kerberos",
    "useSsl": true
  },
  "policy": {
    "applied": true,
    "schemaVersion": "1.0",
    "profileName": "Helpdesk WinRM operations",
    "decision": "Allowed",
    "reasonCode": "PolicyAllowed",
    "reason": "The request satisfies the supplied policy profile."
  },
  "audit": {
    "enabled": false,
    "schemaVersion": null,
    "path": null,
    "eventLog": false,
    "eventSource": null,
    "recordCount": 0,
    "complete": false,
    "hashAlgorithm": null,
    "canonicalization": null,
    "summaryHash": null
  },
  "status": "Succeeded",
  "outcome": "CompleteSuccess",
  "exitCode": 0,
  "targetCount": 3,
  "recordCount": 3,
  "targets": [
    {
      "targetId": "t-220c92273cf41abb8bf20930",
      "target": "client-a-ws01.example.com",
      "status": "Success",
      "startedAtUtc": "2026-08-22T15:00:00.100Z",
      "finishedAtUtc": "2026-08-22T15:00:00.650Z",
      "durationMs": 550,
      "attempts": 1,
      "errorCategory": null,
      "errorMessage": null,
      "data": [
        {
          "ComputerName": "CLIENT-A-WS01",
          "OSName": "Microsoft Windows 11 Enterprise",
          "OSVersion": "10.0.26100",
          "BuildNumber": "26100",
          "Architecture": "64-bit",
          "LastBootTime": "2026-08-20T08:15:00.000Z",
          "Uptime": "2d 6h 45m",
          "Manufacturer": "Contoso Lab Hardware",
          "Model": "Virtual Workstation",
          "Domain": "client-a.example.com",
          "Status": "Success"
        }
      ]
    },
    {
      "targetId": "t-0c552a31902f0b5d11a8b11e",
      "target": "client-b-srv01.example.com",
      "status": "Success",
      "startedAtUtc": "2026-08-22T15:00:00.125Z",
      "finishedAtUtc": "2026-08-22T15:00:00.900Z",
      "durationMs": 775,
      "attempts": 1,
      "errorCategory": null,
      "errorMessage": null,
      "data": [
        {
          "ComputerName": "CLIENT-B-SRV01",
          "OSName": "Microsoft Windows Server 2022 Standard",
          "OSVersion": "10.0.20348",
          "BuildNumber": "20348",
          "Architecture": "64-bit",
          "LastBootTime": "2026-08-01T02:00:00.000Z",
          "Uptime": "21d 13h 0m",
          "Manufacturer": "Contoso Lab Hardware",
          "Model": "Virtual Server",
          "Domain": "client-b.example.com",
          "Status": "Success"
        }
      ]
    },
    {
      "targetId": "t-cd6c4f13f3104c24bd72a9f7",
      "target": "client-c-ws01.example.com",
      "status": "Success",
      "startedAtUtc": "2026-08-22T15:00:00.150Z",
      "finishedAtUtc": "2026-08-22T15:00:01.100Z",
      "durationMs": 950,
      "attempts": 1,
      "errorCategory": null,
      "errorMessage": null,
      "data": [
        {
          "ComputerName": "CLIENT-C-WS01",
          "OSName": "Microsoft Windows 10 Enterprise",
          "OSVersion": "10.0.19045",
          "BuildNumber": "19045",
          "Architecture": "64-bit",
          "LastBootTime": "2026-08-21T19:30:00.000Z",
          "Uptime": "0d 19h 30m",
          "Manufacturer": "Contoso Lab Hardware",
          "Model": "Virtual Workstation",
          "Domain": "client-c.example.com",
          "Status": "Success"
        }
      ]
    }
  ],
  "warnings": [],
  "errors": [],
  "reportPaths": [],
  "actions": []
}
