{
  "schemaVersion": "1.2",
  "toolkitVersion": "3.0.0",
  "runId": "99999999-9999-4999-8999-999999999999",
  "startedAtUtc": "2026-08-22T14:08:00.000Z",
  "finishedAtUtc": "2026-08-22T14:08:00.250Z",
  "durationMs": 250,
  "actionId": "SystemInfo",
  "actionName": "OS Version and Uptime",
  "readOnly": true,
  "stateChanging": false,
  "preflight": false,
  "targetMode": "Local",
  "transport": { "name": "Local", "authentication": null, "useSsl": false },
  "policy": { "applied": false, "schemaVersion": null, "profileName": null, "decision": "NotApplied", "reasonCode": "NoPolicy", "reason": "No policy profile was supplied." },
  "audit": { "enabled": true, "schemaVersion": "1.0", "path": "C:\\Audit\\wat-run-999.jsonl", "eventLog": false, "eventSource": null, "recordCount": 6, "complete": true, "hashAlgorithm": "SHA-256", "canonicalization": "WAT-AUDIT-SUMMARY-1", "summaryHash": "036856b91e9386d2412d4dcd349809c795cf674c157050ead0725ea3ccffc529" },
  "status": "Succeeded",
  "outcome": "CompleteSuccess",
  "exitCode": 0,
  "targetCount": 1,
  "recordCount": 1,
  "targets": [
    {
      "targetId": "t-e80f263f9fedd8fa75de514f",
      "target": "ADMIN-WS01",
      "status": "Success",
      "startedAtUtc": "2026-08-22T14:08:00.025Z",
      "finishedAtUtc": "2026-08-22T14:08:00.225Z",
      "durationMs": 200,
      "attempts": 1,
      "errorCategory": null,
      "errorMessage": null,
      "data": [
        { "ComputerName": "ADMIN-WS01", "OSName": "Microsoft Windows 11 Pro", "Status": "Success" }
      ]
    }
  ],
  "warnings": [],
  "errors": [],
  "reportPaths": [],
  "actions": []
}
